{
  "schemaVersion": 1,
  "id": "gakumas-20260615-hski-cstm-0000",
  "status": "geometry-and-body-texture-poc-verified",
  "game": {
    "unityVersion": "6000.0.67f1",
    "buildGuid": "32d2b7df08344cb7bc4b1611ee280807",
    "exeSha256": "3B1C6DA16B0D9657DB41EE450E80E3312889CEFAD8C2AA9E684EAF087AEE572C"
  },
  "target": {
    "actorId": "hski",
    "actorName": "花海咲季",
    "costumeId": "cstm-0000",
    "bodyResource": "mdl_chr_hski-cstm-0000_body",
    "faceResource": "mdl_chr_hski-base-0000_face",
    "hairResource": "mdl_chr_hski-cstm-0000_hair",
    "environment": "env_3d_adv_waitingroom-00-00-noon",
    "script": "adv_dear_hski_009"
  },
  "capture": {
    "directory": "D:\\Games\\gakumas\\FrameAnalysis-2026-06-21-105931",
    "timestamp": "2026-06-21T10:59:31+08:00",
    "drawCalls": 388,
    "files": 2405,
    "bytes": 290743345,
    "options": "dump_vb dump_ib buf txt desc mono share_dupes",
    "stableSignatureCaptures": [
      "D:\\Games\\gakumas\\FrameAnalysis-2026-06-21-105931",
      "D:\\Games\\gakumas\\FrameAnalysis-2026-06-22-085440",
      "D:\\Games\\gakumas\\FrameAnalysis-2026-06-22-091856",
      "D:\\Games\\gakumas\\FrameAnalysis-2026-06-22-093546",
      "D:\\Games\\gakumas\\FrameAnalysis-2026-06-22-103150",
      "D:\\Games\\gakumas\\FrameAnalysis-2026-06-22-104227",
      "D:\\Games\\gakumas\\FrameAnalysis-2026-06-22-105206",
      "D:\\Games\\gakumas\\FrameAnalysis-2026-06-22-105210"
    ]
  },
  "layout": {
    "topology": "trianglelist",
    "indexFormat": "R16_UINT",
    "positionNormalTangentStride": 40,
    "colorUvStride": 12,
    "positionFormat": "R32G32B32_FLOAT",
    "normalFormat": "R32G32B32_FLOAT",
    "tangentFormat": "R32G32B32A32_FLOAT",
    "colorFormat": "R8G8B8A8_UNORM",
    "uv0Format": "R16G16_FLOAT",
    "uv1Format": "R16G16_FLOAT"
  },
  "skinning": {
    "drawInput": "CPU-skinned dynamic vertex buffer",
    "boneIndexFormat": "Unity BoneWeight: 4 bone indices per vertex",
    "boneWeightFormat": "Unity BoneWeight: 4 float weights per vertex",
    "upstreamSource": "mdl_chr_hski-cstm-0000_body.unity3d / Geo_Body",
    "weightedBones": 152,
    "sourceActiveBones": 147,
    "sourceInactiveBones": [
      "LeftUpLegSkin1_S",
      "RightUpLegSkin1_S",
      "RightLegSkin1_S",
      "LeftLegSkin1_S",
      "LeftSideStrap1_S"
    ],
    "hierarchyNodes": 167,
    "sourceVertexCount": 17615,
    "sourceMeshJson": "Reference/Geo_Body.json",
    "skeletonJson": "Reference/Geo_Body.skeleton.json",
    "verifiedBehavior": "index-only runtime mesh edit preserves game-driven skeletal animation",
    "dynamicVbShaderRead": "verified: 3DMigoto copied body vb0 to t120 and a custom ByteAddressBuffer pixel shader read the known non-zero vertex 0 value",
    "bodyDrawConstantBuffers": {
      "capture": "FrameAnalysis-2026-06-22-025949",
      "cb0": { "hash": "29892a02", "bytes": 2576, "classification": "global camera and lighting data" },
      "cb1": { "hash": "358d62cb", "bytes": 1024, "classification": "object and inverse-object transforms" },
      "cb2": { "hash": "9c475ae5", "bytes": 288, "classification": "material and identity transforms" },
      "cb3": { "hash": "0498a290", "bytes": 368, "classification": "screen projection data; bound but unused by Body VS" },
      "boneMatricesPresent": false
    },
    "gameComputeSkinningDispatchPresent": false,
    "inverseSkin": {
      "sourceVertexCount": 17615,
      "weightedBoneCount": 152,
      "coefficientCount": 608,
      "posedVertexStride": 40,
      "inverseOperator": "Buffers/InverseOperator.R32_FLOAT.buf",
      "meshJson": "Reference/Geo_Body.json",
      "skeletonJson": "Reference/Geo_Body.skeleton.json",
      "unobservableBones": ["RightFrontRibbon1_S"]
    },
    "regionMap": {
      "schema": "body-regions.json",
      "vertexMap": "Buffers/BodyVertexRegions.R16_UINT.buf",
      "triangleMap": "Buffers/BodyTriangleRegions.R16_UINT.buf",
      "regionCount": 387,
      "status": "connected-components-generated-review-required"
    }
  },
  "components": [
    {
      "id": "body",
      "confidence": "verified",
      "ibHash": "4d5dfe7b",
      "vbHashes": {
        "positionNormalTangent": "e189fd22",
        "colorUv": "9c40798a"
      },
      "vertices": 17615,
      "indices": 74664,
      "positionBounds": {
        "min": [-0.249654382, -0.893870592, -0.276112318],
        "max": [0.24584046, 0.423478067, 0.165756077]
      },
      "validation": "handling=skip verified in game on 2026-06-21"
    },
    {
      "id": "face",
      "confidence": "verified",
      "ibHash": "298f5be3",
      "vbHashes": {
        "positionNormalTangent": "8c3cc86d",
        "colorUv": "07aff116",
        "deformedPosition": "3456ac64"
      },
      "vertices": 5227,
      "positionBounds": {
        "min": [-0.10048978, 1.27341962, -0.0593420416],
        "max": [0.0771373734, 1.48197389, 0.117241383]
      },
      "notes": "Multiple submeshes and material passes; see drawcall_map.json.",
      "validation": "handling=skip verified in game on 2026-06-21"
    },
    {
      "id": "hair-main",
      "confidence": "verified",
      "ibHash": "548ce056",
      "vbHashes": {
        "positionNormalTangent": "acf9638c",
        "colorUv": "22a63f89"
      },
      "vertices": 16345,
      "indices": 67410,
      "positionBounds": {
        "min": [-0.18893379, -0.16759634, -0.176995516],
        "max": [0.20855087, 0.239057899, 0.1248037]
      },
      "validation": "handling=skip verified in game on 2026-06-21"
    },
    {
      "id": "hair-accessory",
      "confidence": "verified",
      "ibHash": "672c0ca7",
      "vbHashes": {
        "positionNormalTangent": "701768c3",
        "colorUv": "a0a12ccf"
      },
      "vertices": 1414,
      "indices": 4374,
      "positionBounds": {
        "min": [-0.17734924, -0.173305035, -0.173597768],
        "max": [0.210980058, 0.241737843, 0.128971502]
      },
      "validation": "handling=skip verified as hair accessory in game on 2026-06-21"
    }
  ]
}
